{
  "schema_version": 1,
  "case": {
    "name": "non_power_of_two",
    "queries": 257,
    "sources": 997,
    "route_width": 7,
    "value_dim": 190,
    "dtype": "float32",
    "distribution": "uniform",
    "seed": 4
  },
  "environment": {
    "timestamp_utc": "2026-08-26T00:31:27.360170+00:00",
    "git_revision": "2bd1f8a0514603958f78578e2a8d7512e482a840",
    "platform": "Linux-6.12.95-124.187.amzn2023.x86_64-x86_64-with-glibc2.39",
    "python": "3.12.13",
    "torch": "2.8.0",
    "triton": "3.4.0",
    "cuda": "12.9",
    "gpu": "NVIDIA A10G",
    "compute_capability": [
      8,
      6
    ],
    "total_memory_bytes": 23686938624
  },
  "correctness": {
    "output": {
      "max_abs_error": 1.9073486328125e-06,
      "mean_abs_error": 1.1630194052258958e-07
    }
  },
  "measurements": [
    {
      "backend": "torch_routed_reduction",
      "mode": "forward",
      "cold_compile_or_first_call_ms": 49.35732800004189,
      "median_ms": 0.09666399955749512,
      "p95_ms": 0.11673599481582642,
      "min_ms": 0.0894976019859314,
      "max_ms": 0.12503039836883545,
      "samples": 50,
      "inner_iterations": 10,
      "useful_tflops": 0.007072126159991831,
      "peak_allocated_bytes": 3899392,
      "kernel_metadata": {
        "backend": "torch_routed_reduction",
        "schema_version": 1,
        "accumulation_dtype": "float32"
      }
    },
    {
      "backend": "triton_routed_reduction",
      "mode": "forward",
      "cold_compile_or_first_call_ms": 553.6151910000626,
      "median_ms": 0.03906560093164444,
      "p95_ms": 0.054579198360443115,
      "min_ms": 0.037478399276733396,
      "max_ms": 0.05856639742851257,
      "samples": 50,
      "inner_iterations": 10,
      "useful_tflops": 0.017499282839554247,
      "peak_allocated_bytes": 1359872,
      "kernel_metadata": {
        "backend": "triton_routed_reduction",
        "schema_version": 1,
        "accumulation_dtype": "float32",
        "index_validation_sync": false,
        "routes_per_program": 7,
        "block_d": 256,
        "num_warps": 4
      }
    }
  ]
}
