{
  "schema_version": 1,
  "case": {
    "name": "smoke",
    "queries": 32,
    "sources": 128,
    "route_width": 8,
    "value_dim": 128,
    "dtype": "float16",
    "distribution": "uniform",
    "seed": 0
  },
  "environment": {
    "timestamp_utc": "2026-08-25T23:18:57.557308+00:00",
    "git_revision": "c12d7324736a255a7cc991b03e0b5cf26adc8621",
    "platform": "Linux-6.12.95-124.187.amzn2023.x86_64-x86_64-with-glibc2.39",
    "python": "3.12.13",
    "torch": "2.8.0",
    "triton": "3.4.0",
    "cuda": "12.9",
    "gpu": "NVIDIA A10G",
    "compute_capability": [
      8,
      6
    ],
    "total_memory_bytes": 23686938624
  },
  "correctness": {
    "output": {
      "max_abs_error": 0.0,
      "mean_abs_error": 0.0
    },
    "grad_weights": {
      "max_abs_error": 0.0,
      "mean_abs_error": 0.0
    },
    "grad_values": {
      "max_abs_error": 0.0078125,
      "mean_abs_error": 0.00017783610383048654
    }
  },
  "measurements": [
    {
      "backend": "torch_routed_reduction",
      "mode": "backward",
      "cold_compile_or_first_call_ms": 465.423847999773,
      "median_ms": 0.48752641677856445,
      "p95_ms": 0.5294079780578613,
      "min_ms": 0.42987518310546874,
      "max_ms": 0.5446656227111817,
      "samples": 50,
      "inner_iterations": 10,
      "useful_tflops": 0.0001344255362264125,
      "peak_allocated_bytes": 464384,
      "kernel_metadata": {
        "backend": "torch_routed_reduction",
        "schema_version": 1,
        "accumulation_dtype": "float32"
      }
    },
    {
      "backend": "triton_routed_reduction",
      "mode": "backward",
      "cold_compile_or_first_call_ms": 731.4588889994411,
      "median_ms": 0.29782880544662477,
      "p95_ms": 0.36567039489746095,
      "min_ms": 0.2623487949371338,
      "max_ms": 0.37212159633636477,
      "samples": 50,
      "inner_iterations": 10,
      "useful_tflops": 0.00022004587468200755,
      "peak_allocated_bytes": 192000,
      "kernel_metadata": {
        "backend": "triton_routed_reduction",
        "schema_version": 1,
        "accumulation_dtype": "float32",
        "index_validation_sync": false,
        "routes_per_program": 8,
        "block_d": 128,
        "num_warps": 4
      }
    }
  ]
}
