{
  "schema_version": 1,
  "case": {
    "name": "decode_top2",
    "queries": 1,
    "sources": 64,
    "route_width": 2,
    "value_dim": 4096,
    "dtype": "bfloat16",
    "distribution": "uniform",
    "seed": 1
  },
  "environment": {
    "timestamp_utc": "2026-08-25T22:32:32.664651+00:00",
    "git_revision": "c12d7324736a255a7cc991b03e0b5cf26adc8621",
    "platform": "Linux-6.12.95-124.187.amzn2023.x86_64-x86_64-with-glibc2.39",
    "python": "3.12.13",
    "torch": "2.8.0",
    "triton": "3.4.0",
    "cuda": "12.9",
    "gpu": "NVIDIA A10G",
    "compute_capability": [
      8,
      6
    ],
    "total_memory_bytes": 23686938624
  },
  "correctness": {
    "output": {
      "max_abs_error": 0.0,
      "mean_abs_error": 0.0
    }
  },
  "measurements": [
    {
      "backend": "torch_routed_reduction",
      "mode": "forward",
      "cold_compile_or_first_call_ms": 33.451279000018985,
      "median_ms": 0.12226560115814208,
      "p95_ms": 0.14858239889144897,
      "min_ms": 0.11704319715499878,
      "max_ms": 0.1539072036743164,
      "samples": 50,
      "inner_iterations": 10,
      "useful_tflops": 0.000134003348814426,
      "peak_allocated_bytes": 615936,
      "kernel_metadata": {
        "backend": "torch_routed_reduction",
        "schema_version": 1,
        "accumulation_dtype": "float32"
      }
    },
    {
      "backend": "triton_routed_reduction",
      "mode": "forward",
      "cold_compile_or_first_call_ms": 637.1234150001328,
      "median_ms": 0.10880319476127624,
      "p95_ms": 0.12789759635925294,
      "min_ms": 0.104038405418396,
      "max_ms": 0.13803520202636718,
      "samples": 50,
      "inner_iterations": 10,
      "useful_tflops": 0.0001505838136090391,
      "peak_allocated_bytes": 549888,
      "kernel_metadata": {
        "backend": "triton_routed_reduction",
        "schema_version": 1,
        "accumulation_dtype": "float32",
        "index_validation_sync": false,
        "routes_per_program": 2,
        "block_d": 256,
        "num_warps": 8
      }
    }
  ]
}
